{
  "schema_version": "1.0.0",
  "feature_id": "deterministic-agent-ready-repository",
  "validation_ids": [
    "VAL-READY-020",
    "VAL-READY-021",
    "VAL-READY-022"
  ],
  "tools": [
    {"id": "go", "version": "1.26.4", "probe": "go version"},
    {"id": "node", "version": "22.19.0", "probe": "node --version"},
    {"id": "npm", "version": "10.9.3", "probe": "npm --version"},
    {"id": "python", "version": "3.14.7", "probe": "python3 --version"},
    {"id": "docker", "version": "28.5.1", "probe": "docker --version"},
    {"id": "docker-compose", "version": "2.40.3", "probe": "docker compose version"},
    {"id": "git", "version": "2.50.1", "probe": "git --version"}
  ],
  "environments": [
    {
      "id": "host",
      "definition": "policy/toolchain.json",
      "setup_command": "make setup",
      "readiness_command": "make agent-ready"
    },
    {
      "id": "devcontainer",
      "definition": ".devcontainer/devcontainer.json",
      "setup_command": "make setup",
      "readiness_command": "make agent-ready"
    },
    {
      "id": "compose",
      "definition": "compose.yaml",
      "setup_command": "make setup",
      "readiness_command": "make agent-ready"
    }
  ],
  "services": [
    {
      "id": "postgres",
      "status": "active",
      "image": "postgres:17.11-bookworm@sha256:84560e3b9c6874893fc4e2854f5dc3e7c1a37bc9d1dfd7a8c641310ae22ba5ad",
      "port": 5440,
      "compose_service": "postgres"
    },
    {"id": "api", "status": "reserved", "port": 4700},
    {"id": "site", "status": "reserved", "port": 4701},
    {"id": "integration", "status": "reserved", "port_range": [4710, 4799]}
  ],
  "limitations": [
    "The research-foundation repository has no Go or web dependency graph yet.",
    "API, site, and integration ports are reserved but no placeholder listener is started.",
    "Setup verifies exact bootstrap versions and prepares repository-local state; it does not alter host-wide package managers."
  ]
}
